{
  "project_name": "Transit Corridor Land Assembly - 50 Parcels",
  "project_type": "transit_corridor",
  "parcels": [
    {"id": "P001", "address": "100 Main Street", "area_sqm": 2500, "estimated_value": 750000, "criticality": "critical", "complexity": "high", "holdout_risk": 0.6},
    {"id": "P002", "address": "102 Main Street", "area_sqm": 3000, "estimated_value": 900000, "criticality": "critical", "complexity": "medium", "holdout_risk": 0.5},
    {"id": "P003", "address": "104 Main Street", "area_sqm": 2800, "estimated_value": 840000, "criticality": "critical", "complexity": "medium", "holdout_risk": 0.7},
    {"id": "P004", "address": "106 Main Street", "area_sqm": 3200, "estimated_value": 960000, "criticality": "critical", "complexity": "low", "holdout_risk": 0.4},
    {"id": "P005", "address": "108 Main Street", "area_sqm": 2700, "estimated_value": 810000, "criticality": "critical", "complexity": "high", "holdout_risk": 0.8},
    {"id": "P006", "address": "110 Main Street", "area_sqm": 3500, "estimated_value": 1050000, "criticality": "high", "complexity": "medium", "holdout_risk": 0.5},
    {"id": "P007", "address": "112 Main Street", "area_sqm": 2900, "estimated_value": 870000, "criticality": "high", "complexity": "low", "holdout_risk": 0.3},
    {"id": "P008", "address": "114 Main Street", "area_sqm": 3100, "estimated_value": 930000, "criticality": "high", "complexity": "medium", "holdout_risk": 0.6},
    {"id": "P009", "address": "116 Main Street", "area_sqm": 2600, "estimated_value": 780000, "criticality": "high", "complexity": "low", "holdout_risk": 0.4},
    {"id": "P010", "address": "118 Main Street", "area_sqm": 3400, "estimated_value": 1020000, "criticality": "high", "complexity": "medium", "holdout_risk": 0.5},
    {"id": "P011", "address": "200 Oak Avenue", "area_sqm": 2200, "estimated_value": 660000, "criticality": "medium", "complexity": "low", "holdout_risk": 0.3},
    {"id": "P012", "address": "202 Oak Avenue", "area_sqm": 2400, "estimated_value": 720000, "criticality": "medium", "complexity": "medium", "holdout_risk": 0.4},
    {"id": "P013", "address": "204 Oak Avenue", "area_sqm": 2100, "estimated_value": 630000, "criticality": "medium", "complexity": "low", "holdout_risk": 0.2},
    {"id": "P014", "address": "206 Oak Avenue", "area_sqm": 2800, "estimated_value": 840000, "criticality": "medium", "complexity": "medium", "holdout_risk": 0.5},
    {"id": "P015", "address": "208 Oak Avenue", "area_sqm": 2500, "estimated_value": 750000, "criticality": "medium", "complexity": "low", "holdout_risk": 0.3},
    {"id": "P016", "address": "210 Oak Avenue", "area_sqm": 2700, "estimated_value": 810000, "criticality": "medium", "complexity": "medium", "holdout_risk": 0.4},
    {"id": "P017", "address": "212 Oak Avenue", "area_sqm": 2300, "estimated_value": 690000, "criticality": "medium", "complexity": "low", "holdout_risk": 0.3},
    {"id": "P018", "address": "214 Oak Avenue", "area_sqm": 2600, "estimated_value": 780000, "criticality": "medium", "complexity": "medium", "holdout_risk": 0.4},
    {"id": "P019", "address": "216 Oak Avenue", "area_sqm": 2400, "estimated_value": 720000, "criticality": "medium", "complexity": "low", "holdout_risk": 0.2},
    {"id": "P020", "address": "218 Oak Avenue", "area_sqm": 2900, "estimated_value": 870000, "criticality": "medium", "complexity": "medium", "holdout_risk": 0.5},
    {"id": "P021", "address": "300 Elm Street", "area_sqm": 1800, "estimated_value": 540000, "criticality": "low", "complexity": "low", "holdout_risk": 0.2},
    {"id": "P022", "address": "302 Elm Street", "area_sqm": 2000, "estimated_value": 600000, "criticality": "low", "complexity": "low", "holdout_risk": 0.1},
    {"id": "P023", "address": "304 Elm Street", "area_sqm": 1900, "estimated_value": 570000, "criticality": "low", "complexity": "medium", "holdout_risk": 0.3},
    {"id": "P024", "address": "306 Elm Street", "area_sqm": 2100, "estimated_value": 630000, "criticality": "low", "complexity": "low", "holdout_risk": 0.2},
    {"id": "P025", "address": "308 Elm Street", "area_sqm": 1700, "estimated_value": 510000, "criticality": "low", "complexity": "low", "holdout_risk": 0.1},
    {"id": "P026", "address": "310 Elm Street", "area_sqm": 2200, "estimated_value": 660000, "criticality": "low", "complexity": "medium", "holdout_risk": 0.3},
    {"id": "P027", "address": "312 Elm Street", "area_sqm": 1900, "estimated_value": 570000, "criticality": "low", "complexity": "low", "holdout_risk": 0.2},
    {"id": "P028", "address": "314 Elm Street", "area_sqm": 2000, "estimated_value": 600000, "criticality": "low", "complexity": "low", "holdout_risk": 0.1},
    {"id": "P029", "address": "316 Elm Street", "area_sqm": 1800, "estimated_value": 540000, "criticality": "low", "complexity": "medium", "holdout_risk": 0.3},
    {"id": "P030", "address": "318 Elm Street", "area_sqm": 2100, "estimated_value": 630000, "criticality": "low", "complexity": "low", "holdout_risk": 0.2},
    {"id": "P031", "address": "400 Pine Road", "area_sqm": 3000, "estimated_value": 900000, "criticality": "high", "complexity": "high", "holdout_risk": 0.7},
    {"id": "P032", "address": "402 Pine Road", "area_sqm": 2800, "estimated_value": 840000, "criticality": "high", "complexity": "medium", "holdout_risk": 0.5},
    {"id": "P033", "address": "404 Pine Road", "area_sqm": 3200, "estimated_value": 960000, "criticality": "high", "complexity": "medium", "holdout_risk": 0.6},
    {"id": "P034", "address": "406 Pine Road", "area_sqm": 2700, "estimated_value": 810000, "criticality": "medium", "complexity": "low", "holdout_risk": 0.3},
    {"id": "P035", "address": "408 Pine Road", "area_sqm": 3100, "estimated_value": 930000, "criticality": "medium", "complexity": "medium", "holdout_risk": 0.4},
    {"id": "P036", "address": "410 Pine Road", "area_sqm": 2900, "estimated_value": 870000, "criticality": "medium", "complexity": "low", "holdout_risk": 0.3},
    {"id": "P037", "address": "412 Pine Road", "area_sqm": 3300, "estimated_value": 990000, "criticality": "medium", "complexity": "medium", "holdout_risk": 0.5},
    {"id": "P038", "address": "414 Pine Road", "area_sqm": 2600, "estimated_value": 780000, "criticality": "medium", "complexity": "low", "holdout_risk": 0.2},
    {"id": "P039", "address": "416 Pine Road", "area_sqm": 3000, "estimated_value": 900000, "criticality": "medium", "complexity": "medium", "holdout_risk": 0.4},
    {"id": "P040", "address": "418 Pine Road", "area_sqm": 2800, "estimated_value": 840000, "criticality": "low", "complexity": "low", "holdout_risk": 0.2},
    {"id": "P041", "address": "500 Maple Drive", "area_sqm": 2500, "estimated_value": 750000, "criticality": "critical", "complexity": "high", "holdout_risk": 0.8},
    {"id": "P042", "address": "502 Maple Drive", "area_sqm": 2700, "estimated_value": 810000, "criticality": "critical", "complexity": "medium", "holdout_risk": 0.6},
    {"id": "P043", "address": "504 Maple Drive", "area_sqm": 2900, "estimated_value": 870000, "criticality": "critical", "complexity": "high", "holdout_risk": 0.7},
    {"id": "P044", "address": "506 Maple Drive", "area_sqm": 2400, "estimated_value": 720000, "criticality": "high", "complexity": "medium", "holdout_risk": 0.5},
    {"id": "P045", "address": "508 Maple Drive", "area_sqm": 2600, "estimated_value": 780000, "criticality": "high", "complexity": "low", "holdout_risk": 0.4},
    {"id": "P046", "address": "510 Maple Drive", "area_sqm": 2300, "estimated_value": 690000, "criticality": "medium", "complexity": "medium", "holdout_risk": 0.4},
    {"id": "P047", "address": "512 Maple Drive", "area_sqm": 2500, "estimated_value": 750000, "criticality": "medium", "complexity": "low", "holdout_risk": 0.3},
    {"id": "P048", "address": "514 Maple Drive", "area_sqm": 2200, "estimated_value": 660000, "criticality": "low", "complexity": "low", "holdout_risk": 0.2},
    {"id": "P049", "address": "516 Maple Drive", "area_sqm": 2400, "estimated_value": 720000, "criticality": "low", "complexity": "medium", "holdout_risk": 0.3},
    {"id": "P050", "address": "518 Maple Drive", "area_sqm": 2100, "estimated_value": 630000, "criticality": "low", "complexity": "low", "holdout_risk": 0.1}
  ],
  "priorities": {
    "criticality": 0.5,
    "holdout_risk": 0.3,
    "complexity": 0.2
  },
  "resources": {
    "appraisers": 3,
    "negotiators": 5,
    "legal_staff": 2,
    "appraisal_days_per_parcel": 10,
    "negotiation_days_per_parcel": 30,
    "legal_days_per_parcel": 5,
    "daily_rates": {
      "appraiser": 1500,
      "negotiator": 1200,
      "legal": 2000
    }
  },
  "contingencies": {
    "valuation_uncertainty": 0.10,
    "negotiation_premium": 0.05,
    "litigation_reserve": 0.15,
    "inflation": 0.03,
    "appraisal_cost_per_parcel": 5000,
    "legal_cost_per_parcel": 3000,
    "environmental_cost_per_parcel": 2000
  },
  "delay_analysis": {
    "interest_rate": 0.05,
    "construction_cost_per_day": 75000,
    "revenue_loss_per_day": 50000,
    "project_start_delay_days": 120
  }
}
